{
  "schema_name": "scientific-evidence.artifact-manifest",
  "artifact": {
    "path": "results/longmemeval_session_rerank/run_v2/per_question_asof_metrics.csv",
    "kind": "derived",
    "media_type": "text/csv",
    "sha256": "94865ae57a6911de34dfdf6e68e0f46c783890add9df804ded5ca4dc13a4fda7"
  },
  "derived_from": [
    "@evidence[[data/external/longmemeval/longmemeval_s_cleaned.json]]",
    "@evidence[[results/longmemeval_session_rerank/experiment_contract.json]]",
    "@evidence[[results/longmemeval_session_rerank/run_experiment.py]]"
  ],
  "generated_by": {
    "script_path": "results/longmemeval_session_rerank/run_experiment.py",
    "script_sha256": "213fec47eead17b53152d19921cdc5cb90b4faa8344a5b2e2df16c412c5e9123",
    "cwd": "ASOC",
    "command": [
      "python3",
      "results/longmemeval_session_rerank/run_experiment.py",
      "--data",
      "data/external/longmemeval/longmemeval_s_cleaned.json",
      "--contract",
      "results/longmemeval_session_rerank/experiment_contract.json",
      "--output",
      "results/longmemeval_session_rerank/run_v2"
    ],
    "started_at": "2026-10-29T12:51:32+08:00",
    "finished_at": "2026-10-29T12:51:44+08:00"
  },
  "notes": "Strict question-date sensitivity; all original qrels stay in the micro-recall denominator, so unavailable future qrels count as misses."
}
