{
  "schema_name": "scientific-evidence.artifact-manifest",
  "artifact": {
    "path": "results/longmemeval_session_rerank/reproduction_check_20261029/summary.json",
    "kind": "derived",
    "media_type": "application/json",
    "sha256": "c0362529d36b59da722e8a4d3b2c354c2089473a83b1b192b0f31c9f4133c91d"
  },
  "derived_from": [
    "@evidence[[data/external/longmemeval/longmemeval_s_cleaned.json]]",
    "@evidence[[results/longmemeval_session_rerank/experiment_contract.json]]",
    "@evidence[[results/longmemeval_session_rerank/run_experiment.py]]"
  ],
  "generated_by": {
    "script_path": "results/longmemeval_session_rerank/run_experiment.py",
    "script_sha256": "213fec47eead17b53152d19921cdc5cb90b4faa8344a5b2e2df16c412c5e9123",
    "cwd": "ASOC",
    "command": [
      "python3",
      "results/longmemeval_session_rerank/run_experiment.py",
      "--data",
      "data/external/longmemeval/longmemeval_s_cleaned.json",
      "--contract",
      "results/longmemeval_session_rerank/experiment_contract.json",
      "--output",
      "results/longmemeval_session_rerank/reproduction_check_20261029",
      "--self-test"
    ],
    "started_at": "2026-10-29T13:59:52+08:00",
    "finished_at": "2026-10-29T14:00:03+08:00"
  },
  "notes": "Independent rerun; ten built-in self-tests passed. Dataset, contract, script, full results, interpretation, and per-question CSVs match the accepted run_v2. The summary's internal canonical command omits the optional --self-test flag; this sidecar records the actual invocation."
}
